<?xml version="1.0" encoding="UTF-8"?>
<!DOCTYPE primitive SYSTEM "ophidiaprimitive.dtd">
<primitive name="oph_bit_size" version="1.0">
    <info>
        <abstract>[Behaviour]
Computes the size of the bit measure. This is the smallest multiple number of 8 bigger or equal than the bit measure.

[Parameters]
- input data type : not used.
- output data type : not used.
- measure : input measure.

[Return type]
Long-long.
        
[Examples]
oph_bit_size(&apos;&apos;,&apos;&apos;,measure)</abstract>
        <author>CMCC Foundation</author>
        <creationdate>27/07/2013</creationdate>
        <license url="http://www.gnu.org/licenses/gpl.txt">GPLv3</license>
        <return type="long-long" />
	<operation type="reduce"/>
    </info>
    <args>
	<argument type="oph_type" mandatory="yes">input data type</argument>
	<argument type="oph_type" mandatory="yes">output data type</argument>
	<argument type="bit-array" mandatory="yes">measure</argument>
    </args>
</primitive>
