<?xml version="1.0" encoding="UTF-8"?>
<!DOCTYPE primitive SYSTEM "ophidiaprimitive.dtd">
<primitive name="oph_operator" version="1.0">
    <info>
        <abstract>[Behaviour]
Applies an operator on the whole measure array.

[Parameters]
- input measure type : Ophidia typing. Supported types are:
					&apos;oph_double&apos;;
					&apos;oph_float&apos;;
					&apos;oph_long&apos;;
					&apos;oph_int&apos;;
					&apos;oph_short&apos;;
					&apos;oph_byte&apos;.
- output measure type : Ophidia typing. Supported types are:
					&apos;oph_double&apos;;
					&apos;oph_float&apos;;
					&apos;oph_long&apos;;
					&apos;oph_int&apos;;
					&apos;oph_short&apos;;
					&apos;oph_byte&apos;.
- measure : input measure.
- operator name : type of operator
                    -- &apos;oph_count&apos; : compute the number of actual values (not missing);
                    -- &apos;oph_max&apos; : compute the maximum (default);
                    -- &apos;oph_min&apos; : compute the minimum;
                    -- &apos;oph_avg&apos; : compute the mean of all elements;
                    -- &apos;oph_sum&apos; : compute the sum of all elements;
                    -- &apos;oph_std&apos; : compute the standard deviation;
                    -- &quot;oph_cmoment&quot; : compute the central moment;
                    -- &quot;oph_acmoment&quot; : compute the absolute central moment;
                    -- &quot;oph_rmoment&quot; : compute the raw moment;
                    -- &quot;oph_armoment&quot; : compute the absolute raw moment;
                    -- &quot;oph_quantile&quot; : compute the quantile.
- hierarchy : it defines a hierarchy [not used].
- order : order used in evaluation the moments or value of the quantile in range [0, 1].

[Return type]
Binary-array.
        
[Examples]
Compute the mean of all elements.
oph_operator(&apos;OPH_DOUBLE&apos;,&apos;OPH_DOUBLE&apos;,measure,&apos;OPH_AVG&apos;)</abstract>
        <author>CMCC Foundation</author>
        <creationdate>27/07/2013</creationdate>
        <license url="http://www.gnu.org/licenses/gpl.txt">GPLv3</license>
        <return type="binary-array" />
	<operation type="reduce"/>
    </info>
    <args>
	<argument type="oph_type" mandatory="yes" values="'oph_double'|'oph_float'|'oph_int'|'oph_long'|'oph_short'|'oph_byte'">input measure type</argument>
	<argument type="oph_type" mandatory="yes" values="'oph_double'|'oph_float'|'oph_int'|'oph_long'|'oph_short'|'oph_byte'">output measure type</argument>
	<argument type="binary-array" mandatory="yes">measure</argument>
	<argument type="oph_operator" mandatory="no" default="'oph_max'" values="'oph_count','oph_max'|'oph_min'|'oph_avg'|'oph_sum'|'oph_std'|'oph_cmoment'|'oph_acmoment'|'oph_rmoment'|'oph_armoment'">operator name</argument>
	<argument type="string" mandatory="no" default="'oph_all'" values="'oph_all'">hierarchy</argument>
	<argument type="double" mandatory="no" default="2" minvalue="0">order</argument>
    </args>
</primitive>
