<?xml version="1.0" encoding="UTF-8"?>
<!DOCTYPE primitive SYSTEM "ophidiaprimitive.dtd">
<primitive name="oph_extend" version="1.0">
    <info>
        <abstract>[Behaviour]
Return an array obtained by concatenating input array more times. Append mode concatenates arrays in sequence, Interlace mode replies each element in place one by one.

[Parameters]
- input measure type : Ophidia typing. Supported types are:
					&apos;oph_double&apos;;
					&apos;oph_float&apos;;
					&apos;oph_long&apos;;
					&apos;oph_int&apos;;
					&apos;oph_short&apos;;
					&apos;oph_byte&apos;.
- output measure type : Ophidia typing. Supported types are:
					&apos;oph_double&apos;;
					&apos;oph_float&apos;;
					&apos;oph_long&apos;;
					&apos;oph_int&apos;;
					&apos;oph_short&apos;;
					&apos;oph_byte&apos;.
- measure : list of input measure.
- number : number of replies.
- mode : use 'a' to concatenate input cubes (default), use 'i' to interlace input cubes.

[Return type]
Binary-array.

[Examples]
Concatenate input array four times.
oph_extend(&apos;OPH_DOUBLE&apos;,&apos;OPH_DOUBLE&apos;,measure,4)</abstract>
        <author>CMCC Foundation</author>
        <category>Core Array</category>
        <creationdate>27/07/2013</creationdate>
        <license url="http://www.gnu.org/licenses/gpl.txt">GPLv3</license>
        <return type="binary-array" />
        <operation type="simple"/>
    </info>
    <args>
		<argument type="oph_type" mandatory="yes" default="'oph_double'" values="'oph_double'|'oph_float'|'oph_int'|'oph_long'|'oph_short'|'oph_byte'">input measure type</argument>
		<argument type="oph_type" mandatory="yes" default="'oph_double'" values="'oph_double'|'oph_float'|'oph_int'|'oph_long'|'oph_short'|'oph_byte'">output measure type</argument>
		<argument type="binary-array" mandatory="yes">measure</argument>
		<argument type="int" mandatory="no" default="1" minvalue="1">number</argument>
		<argument type="string" mandatory="no" default="'a'" values="'a'|'i'">mode</argument>
    </args>
</primitive>
