<?xml version="1.0" encoding="UTF-8"?>
<!DOCTYPE primitive SYSTEM "ophidiaprimitive.dtd">
<primitive name="oph_zonal_stats" version="1.0">
    <info>
        <abstract>[Behaviour]
Returns an array in which a zonal statistical metrix has been applied to the matrix represeted by the input array.
        
[Parameters]
- input measure type : Ophidia typing. Supported types are:
					&apos;oph_double&apos;;
					&apos;oph_float&apos;;
					&apos;oph_long&apos;;
					&apos;oph_int&apos;;
					&apos;oph_short&apos;;
					&apos;oph_byte&apos;.
- output measure type : Ophidia typing. Supported types are:
					&apos;oph_double&apos;;
					&apos;oph_float&apos;;
					&apos;oph_long&apos;;
					&apos;oph_int&apos;;
					&apos;oph_short&apos;;
					&apos;oph_byte&apos;.
- measure : input measure.
- buffer : zone size (0 means 1 pixel, 1 means a square of 9 pixels, etc.)
- operator name : type of operator
                  -- &apos;oph_max&apos; : compute the maximum value of a zone (default);
                  -- &apos;oph_min&apos; : compute the minimum value of a zone;
                  -- &apos;oph_avg&apos; : compute the mean of all elements of a zoene;
                  -- &apos;oph_sum&apos; : compute the sum of all elements of a zone.
- missingvalue : value to be considered as missing value; by default it is NAN (for &apos;oph_double&apos; and &apos;oph_float&apos;).
- sampling : flag set in case data have to be sampled on the center of the zone.

[Return type]
Binary-array.
        
[Examples]
oph_zonal_stats(&apos;OPH_DOUBLE&apos;,&apos;OPH_DOUBLE&apos;,measure)</abstract>
        <author>CMCC Foundation</author>
        <category>Transformation</category>
        <creationdate>02/02/2020</creationdate>
        <license url="http://www.gnu.org/licenses/gpl.txt">GPLv3</license>
        <return type="binary-array" />
        <operation type="simple"/>
    </info>
    <args>
		<argument type="oph_type" mandatory="yes" values="'oph_double'|'oph_float'|'oph_int'|'oph_long'|'oph_short'|'oph_byte'">input measure type</argument>
		<argument type="oph_type" mandatory="yes" values="'oph_double'|'oph_float'|'oph_int'|'oph_long'|'oph_short'|'oph_byte'">output measure type</argument>
		<argument type="binary-array" mandatory="yes">measure</argument>
		<argument type="double" mandatory="no" default="0" minvalue="0">buffer</argument>
		<argument type="oph_operator" mandatory="no" default="'oph_max'" values="'oph_max'|'oph_min'|'oph_avg'|'oph_sum'">operator name</argument>
		<argument type="double" mandatory="no" default="NAN">missingvalue</argument>
		<argument type="string" mandatory="no" default="yes" values="yes|no">sampling</argument>
    </args>
</primitive>
