<?xml version="1.0" encoding="UTF-8"?>
<!DOCTYPE primitive SYSTEM "ophidiaprimitive.dtd">
<primitive name="oph_gsl_complex_to_rect" version="1.0">
    <info>
        <abstract>[Behaviour]
Converts a binary array of complex numbers expressed in polar form into the rectangular form.

[Parameters]
- input measure type : Ophidia typing. Supported types are:
                         &apos;oph_complex_double&apos;;
                         &apos;oph_complex_float&apos;;
                         &apos;oph_complex_int&apos;;
                         &apos;oph_complex_long&apos;.
- output measure type : Ophidia typing. Supported types are:
                         &apos;oph_complex_double&apos;;
                         &apos;oph_complex_float&apos;;
                         &apos;oph_complex_int&apos;;
                         &apos;oph_complex_long&apos;.
- measure : input measure.

[Return type]
Binary-array.

[Examples]
Get the rectangular form of an array of complex numbers expressed in polar coordinates.
oph_gsl_complex_to_rect(&apos;OPH_COMPlEX_DOUBLE&apos;,&apos;OPH_COMPLEX_DOUBLE&apos;,measure)</abstract>
        <author>CMCC Foundation</author>
        <category>Arithmetic</category>
        <creationdate>27/07/2013</creationdate>
        <license url="http://www.gnu.org/licenses/gpl.txt">GPLv3</license>
        <return type="binary-array" />
        <operation type="simple"/>
    </info>
    <args>
		<argument type="oph_type" mandatory="yes" values="'oph_complex_double'|'oph_complex_float'|'oph_complex_int'|'oph_complex_long'">input measure type</argument>
		<argument type="oph_type" mandatory="yes" values="'oph_complex_double'|'oph_complex_float'|'oph_complex_int'|'oph_complex_long'">output measure type</argument>
		<argument type="binary-array" mandatory="yes">measure</argument>
    </args>
</primitive>
