<?xml version="1.0" encoding="UTF-8"?>
<!DOCTYPE primitive SYSTEM "ophidiaprimitive.dtd">
<primitive name="oph_expand" version="1.0">
    <info>
        <abstract>[Behaviour]
Returns an array in which each element is copied from input measure if the corresponding element in the array &apos;indexes&apos; is present in the set identified by subset string &apos;start:stride:stop&apos;. If the element is not present then a &apos;filling&apos; item is put.

[Parameters]
- input measure type : Ophidia typing. Supported types are:
					&apos;oph_double&apos;;
					&apos;oph_float&apos;;
- output measure type : Ophidia typing. Supported types are:
					&apos;oph_double&apos;;
					&apos;oph_float&apos;;
- measure : input measure.
- indexes : input index array used to select data from input measure; lengths of both input arrays should be equal; supported type is only &apos;oph_double&apos;.
- start : index of the first element of output array; if NULL it corresponds to the first index in &apos;indexes&apos;.
- stride : step between successive elements in output array; if NULL it is set to 1.
- stop : index of the last element of output array; if NULL it corresponds to the last index in &apos;indexes&apos;.
- filling : item to be added or operation to be performed in case of empty elements; it can be set to:
            &apos;NAN&apos;, to fill empty elements with NAN (default);
            &apos;interp&apos;, to fill empty elements with the corrsponding value of the set identified by input subset string;
            a real number, to fill empty elements with a number.

[Return type]
Binary-array.
        
[Examples]
Fill monthly data with NAN when time dimension unit is &apos;day&apos;.
oph_expand(&apos;OPH_DOUBLE&apos;,&apos;OPH_DOUBLE&apos;,measure,dimension,NULL,30.4375)</abstract>
        <author>CMCC Foundation</author>
        <creationdate>25/03/2016</creationdate>
        <license url="http://www.gnu.org/licenses/gpl.txt">GPLv3</license>
        <return type="binary-array" />
	<operation type="simple"/>
    </info>
    <args>
	<argument type="oph_type" mandatory="yes" values="'oph_double'|'oph_float'">input measure type</argument>
	<argument type="oph_type" mandatory="yes" values="'oph_double'|'oph_float'">output measure type</argument>
	<argument type="binary-array" mandatory="yes">measure</argument>
	<argument type="binary-array" mandatory="no" default="NULL">indexes</argument>
	<argument type="double" mandatory="no" default="NULL">start</argument>
	<argument type="double" mandatory="no" default="1">stride</argument>
	<argument type="double" mandatory="no" default="NULL">stop</argument>
	<argument type="string" mandatory="no" default="NAN">filling</argument>
    </args>
</primitive>
