<?xml version="1.0" encoding="UTF-8"?>
<!DOCTYPE primitive SYSTEM "ophidiaprimitive.dtd">
<primitive name="oph_aggregate_operator" version="1.0">
    <info>
        <abstract>[Behaviour]
Aggregates different measure arrays performing the specified operation on each column of array elements.

[Parameters]
- input measure type : Ophidia typing. Supported types are:
					&apos;oph_double&apos;;
					&apos;oph_float&apos;;
					&apos;oph_long&apos;;
					&apos;oph_int&apos;;
					&apos;oph_short&apos;;
					&apos;oph_byte&apos;.
- output measure type : Ophidia typing. Supported types are:
					&apos;oph_double&apos;;
					&apos;oph_float&apos;;
					&apos;oph_long&apos;;
					&apos;oph_int&apos;;
					&apos;oph_short&apos;;
					&apos;oph_byte&apos;.
- measure : input measure.
- operator name : type of aggregation.
                -- &apos;oph_count&apos; : compute the number of elements;
                -- &apos;oph_max&apos; : compute the maximum (default);
                -- &apos;oph_min&apos; : compute the minimum;
                -- &apos;oph_avg&apos; : compute the mean;
                -- &apos;oph_sum&apos; : compute the sum;
                -- &apos;oph_max_abs&apos; : compute the maximum of absolutes values;
                -- &apos;oph_min_abs&apos; : compute the minimum of absolutes values.
- missingvalue : value to be considered as missing value; by default it is NAN (for &apos;oph_double&apos; and &apos;oph_float&apos;).

[Return type]
Binary-array.

[Examples]
Compute the mean value.
oph_aggregate_operator(&apos;OPH_DOUBLE&apos;,&apos;OPH_DOUBLE&apos;,measure,&apos;OPH_AVG&apos;)</abstract>
        <author>CMCC Foundation</author>
        <category>Statistical</category>
        <creationdate>27/07/2013</creationdate>
        <license url="http://www.gnu.org/licenses/gpl.txt">GPLv3</license>
        <return type="binary-array" />
        <operation type="aggregate"/>
    </info>
    <args>
		<argument type="oph_type" mandatory="yes" values="'oph_double'|'oph_float'|'oph_int'|'oph_long'|'oph_short'|'oph_byte'">input data type</argument>
		<argument type="oph_type" mandatory="yes" values="'oph_double'|'oph_float'|'oph_int'|'oph_long'|'oph_short'|'oph_byte'">output data type</argument>
		<argument type="binary-array" mandatory="yes">measure</argument>
		<argument type="oph_operator" mandatory="no" default="'oph_max'" values="'oph_count'|'oph_max'|'oph_min'|'oph_avg'|'oph_sum'|'oph_max_abs'|'oph_min_abs'">operator name</argument>
		<argument type="double" mandatory="no" default="NAN">missingvalue</argument>
    </args>
</primitive>
