<?xml version="1.0" encoding="UTF-8"?>
<!DOCTYPE primitive SYSTEM "ophidiaprimitive.dtd">
<primitive name="oph_bit_shift" version="1.0">
    <info>
        <abstract>[Behaviour]
Executes a shifting operation of &apos;offset&apos; bits inside the measure array using the &apos;filling&apos; character.

[Parameters]
- input data type : not used.
- output data type : not used.
- measure : input measure.
- offset : specify the number of 1-bit movements.
           If offset&gt;0 then shift to the right.
           If offset&lt;0 then shift to the left.
           Default value (0) corresponds to no shift.
- filling : filling character, 0 (default) or 1.

[Return type]
Bit-array.

[Examples]
Execute a 10-bit shift to the right.
oph_bit_shift(&apos;&apos;,&apos;&apos;,bit_measure,10)</abstract>
        <author>CMCC Foundation</author>
        <creationdate>27/07/2013</creationdate>
        <license url="http://www.gnu.org/licenses/gpl.txt">GPLv3</license>
        <return type="bit-array" />
	<operation type="simple"/>
    </info>
    <args>
	<argument type="oph_type" mandatory="yes">input data type</argument>
	<argument type="oph_type" mandatory="yes">output data type</argument>
	<argument type="bit-array" mandatory="yes">measure</argument>
	<argument type="long-long" mandatory="no" default="0">offset</argument>
	<argument type="bit" mandatory="no" default="0" values="0|1">filling</argument>
    </args>
</primitive>
