<?xml version="1.0" encoding="UTF-8"?>
<!DOCTYPE primitive SYSTEM "ophidiaprimitive.dtd">
<primitive name="oph_gsl_stats" version="1.0">
    <info>
        <abstract>[Behaviour]
Compute statistical indexes of the measure array. The type of indexes depends on a mask.
        
[Parameters]
- input measure type : Ophidia typing. Supported types are:
					&apos;oph_double&apos;;
					&apos;oph_float&apos;;
					&apos;oph_long&apos;;
					&apos;oph_int&apos;;
					&apos;oph_short&apos;;
					&apos;oph_byte&apos;.
- output measure type : Ophidia typing. Supported types are:
					&apos;oph_double&apos;;
					&apos;oph_float&apos;;
					&apos;oph_long&apos;;
					&apos;oph_int&apos;;
					&apos;oph_short&apos;;
					&apos;oph_byte&apos;.
- measure : input measure.
- mask : possible values are
         -- 00000000000000 : invalid
         -- 1xxxxxxxxxxxxx : mean
         -- x1xxxxxxxxxxxx : variance
         -- xx1xxxxxxxxxxx : std dev
         -- xxx1xxxxxxxxxx : abs dev
         -- xxxx1xxxxxxxxx : skew
         -- xxxxx1xxxxxxxx : kurtosis
         -- xxxxxx1xxxxxxx : autocorrelation
         -- xxxxxxx1xxxxxx : max
         -- xxxxxxxx1xxxxx : min
         -- xxxxxxxxx1xxxx : 0.05 quantile
         -- xxxxxxxxxx1xxx : 0.25 quantile ->Q1
         -- xxxxxxxxxxx1xx : 0.5  quantile ->Q2 (median)
         -- xxxxxxxxxxxx1x : 0.75 quantile ->Q3
         -- xxxxxxxxxxxxx1 : 0.95 quantile
         -- 11111111111111 : all (default)
         -- 101            : mean + std dev
         -- â€¦
        
[Return type]
Binary-array.
        
[Examples]
Compute the mean and the standard deviation of input measures.
oph_gsl_stats(&apos;OPH_DOUBLE&apos;,&apos;OPH_DOUBLE&apos;,measure,&apos;101&apos;)</abstract>
        <author>CMCC Foundation</author>
        <category>Statistical</category>
        <creationdate>27/07/2013</creationdate>
        <license url="http://www.gnu.org/licenses/gpl.txt">GPLv3</license>
        <return type="binary-array" />
        <operation type="reduce"/>
    </info>
    <args>
		<argument type="oph_type" mandatory="yes" values="'oph_double'|'oph_float'|'oph_int'|'oph_long'|'oph_short'|'oph_byte'">input measure type</argument>
		<argument type="oph_type" mandatory="yes" values="'oph_double'|'oph_float'|'oph_int'|'oph_long'|'oph_short'|'oph_byte'">output measure type</argument>
		<argument type="binary-array" mandatory="yes">measure</argument>
		<argument type="string" mandatory="no" default="11111111111111">mask</argument>
    </args>
</primitive>
