<?xml version="1.0" encoding="UTF-8"?>
<!DOCTYPE primitive SYSTEM "ophidiaprimitive.dtd">
<primitive name="oph_concat" version="1.0">
    <info>
        <abstract>[Behaviour]
Builds a new measure array concatenating the measures specified.

[Parameters]
- input measure type : Ophidia typing. Supported types are:
					&apos;oph_double&apos;;
					&apos;oph_float&apos;;
					&apos;oph_long&apos;;
					&apos;oph_int&apos;;
					&apos;oph_short&apos;;
					&apos;oph_byte&apos;.
- output measure type : Ophidia typing. Supported types are:
					&apos;oph_double&apos;;
					&apos;oph_float&apos;;
					&apos;oph_int&apos;;
					&apos;oph_short&apos;;
					&apos;oph_byte&apos;.
- measure : list of input measures.

[Return type]
Binary-array.

[Examples]
Concatenate measures 60-90 to measures 1-30.
oph_concat(&apos;OPH_DOUBLE|OPH_DOUBLE&apos;,&apos;&apos;,oph_get_subarray(&apos;OPH_DOUBLE&apos;,&apos;&apos;,measure,1,30),oph_get_subarray(&apos;OPH_DOUBLE&apos;,&apos;&apos;,measure,60,31))</abstract>
        <author>CMCC Foundation</author>
        <creationdate>27/07/2013</creationdate>
        <license url="http://www.gnu.org/licenses/gpl.txt">GPLv3</license>
        <return type="binary-array" />
	<operation type="simple"/>
    </info>
    <args>
        <multi-argument type="oph_type" mandatory="yes" default="'oph_double'" values="'oph_double'|'oph_float'|'oph_int'|'oph_long'|'oph_short'|'oph_byte'">input measure type</multi-argument>
        <argument type="oph_type" mandatory="yes" default="'oph_double'" values="'oph_double'|'oph_float'|'oph_int'|'oph_long'|'oph_short'|'oph_byte'">output measure type</argument>
	<multi-argument type="binary-array" mandatory="yes">measure</multi-argument>
    </args>
</primitive>
